{
  "$schema": "https://json-schema.org/draft/2020-12/schema",
  "$id": "https://hadr.example/contract.v2.schema.json",
  "title": "Contract",
  "type": "object",
  "additionalProperties": false,
  "required": ["schema_version", "generated_at", "meta", "events"],
  "properties": {
    "schema_version": { "const": "2.0.0" },
    "generated_at": { "type": "string", "format": "date-time" },
    "meta": {
      "type": "object",
      "additionalProperties": false,
      "required": ["feeds"],
      "properties": {
        "feeds": { "type": "array", "items": { "$ref": "#/$defs/FeedHealth" } }
      }
    },
    "events": { "type": "array", "items": { "$ref": "#/$defs/CrisisEvent" } }
  },
  "$defs": {
    "FeedHealth": {
      "title": "FeedHealth",
      "type": "object",
      "additionalProperties": false,
      "required": ["source", "window", "status", "fetched_at", "event_count"],
      "properties": {
        "source": { "type": "string", "enum": ["usgs", "gdacs"] },
        "window": { "type": "string", "enum": ["all_day", "significant_week", "events4app"] },
        "status": { "type": "string", "enum": ["ok", "error"] },
        "fetched_at": { "type": "string", "format": "date-time" },
        "event_count": { "type": "integer", "minimum": 0 },
        "error": { "type": ["string", "null"] }
      }
    },
    "Geometry": {
      "title": "Geometry",
      "type": "object",
      "additionalProperties": false,
      "required": ["lat", "lon"],
      "properties": {
        "lat": { "type": "number", "minimum": -90, "maximum": 90 },
        "lon": { "type": "number", "minimum": -180, "maximum": 180 },
        "depth_km": { "type": ["number", "null"] }
      }
    },
    "SeverityInputs": {
      "title": "SeverityInputs",
      "type": "object",
      "additionalProperties": false,
      "required": ["mag", "sig", "alert", "alert_score"],
      "properties": {
        "mag": { "type": ["number", "null"] },
        "sig": { "type": ["integer", "null"] },
        "alert": { "type": ["string", "null"], "enum": ["green", "yellow", "orange", "red", null] },
        "alert_score": { "type": ["number", "null"] }
      }
    },
    "SeverityBoost": {
      "title": "SeverityBoost",
      "type": "object",
      "additionalProperties": false,
      "required": ["nearest_place", "population", "distance_km", "applied"],
      "properties": {
        "nearest_place": { "type": ["string", "null"] },
        "population": { "type": ["integer", "null"] },
        "distance_km": { "type": ["number", "null"] },
        "applied": { "type": "number", "minimum": 0 }
      }
    },
    "Severity": {
      "title": "Severity",
      "type": "object",
      "additionalProperties": false,
      "required": ["level", "score", "inputs", "boost"],
      "properties": {
        "level": { "type": "string", "enum": ["minor", "moderate", "serious", "severe"] },
        "score": { "type": "number", "minimum": 0 },
        "inputs": { "$ref": "#/$defs/SeverityInputs" },
        "boost": { "$ref": "#/$defs/SeverityBoost" }
      }
    },
    "FeedSource": {
      "title": "FeedSource",
      "type": "object",
      "additionalProperties": false,
      "required": ["feed", "id", "url"],
      "properties": {
        "feed": { "type": "string", "enum": ["usgs", "gdacs"] },
        "id": { "type": "string" },
        "url": { "type": "string", "format": "uri" }
      }
    },
    "Affected": {
      "title": "Affected",
      "type": "object",
      "additionalProperties": false,
      "required": ["estimate", "basis", "source"],
      "properties": {
        "estimate": { "type": ["integer", "null"], "minimum": 0 },
        "basis": { "type": "string" },
        "source": { "type": ["string", "null"], "enum": ["gdacs", null] }
      }
    },
    "CrisisEvent": {
      "title": "CrisisEvent",
      "type": "object",
      "additionalProperties": false,
      "required": ["id", "hazard", "title", "place", "time", "geometry", "magnitude", "severity", "major", "provisional", "sources", "affected"],
      "properties": {
        "id": { "type": "string", "pattern": "^[a-z]+:.+" },
        "hazard": { "type": "string", "enum": ["EQ", "TC", "FL", "VO", "DR"] },
        "title": { "type": "string" },
        "place": { "type": "string" },
        "time": { "type": "string", "format": "date-time" },
        "geometry": { "$ref": "#/$defs/Geometry" },
        "magnitude": { "type": ["number", "null"] },
        "severity": { "$ref": "#/$defs/Severity" },
        "major": { "type": "boolean" },
        "provisional": { "type": "boolean" },
        "sources": { "type": "array", "minItems": 1, "items": { "$ref": "#/$defs/FeedSource" } },
        "affected": { "$ref": "#/$defs/Affected" }
      }
    }
  }
}
